url,video_id,upload_time,title,description
https://www.youtube.com/watch?v=cubPiuD7_dA,cubPiuD7_dA,2019-10-09T12:00:07Z,*Watches Gary Vaynerchuk Once*,"Gary Vaynerchuk is a legend. He taught me the importance of putting out content, and his advice changed my damn life."
https://www.youtube.com/watch?v=aEAs8NRVfYE,aEAs8NRVfYE,2019-09-25T12:00:00Z,*Watches David Goggins Once*,"Callus your mind and stop gettin' poopy pants, for cryin out loud. I wasn't planning on going on a rampage with these videos, but ..."
https://www.youtube.com/watch?v=None,,2019-09-03T16:25:33Z,The *Watches Once* Series,The videos you are most likely to have clicked on at some point.
https://www.youtube.com/watch?v=None,,2018-11-19T14:20:30Z,NoFap,
https://www.youtube.com/watch?v=None,,2020-10-07T14:18:08Z,The Director Parody Series,
https://www.youtube.com/watch?v=None,,2022-08-05T05:16:10Z,A Life in Momentum Podcast,
https://www.youtube.com/watch?v=None,,2023-03-25T05:24:10Z,In Pursuit of Greatness,
https://www.youtube.com/watch?v=0rrnew31Quw,0rrnew31Quw,2019-05-12T14:00:00Z,Stoicism: The Power of Indifference to Obstacles,"In ""The Obstacle is the Way"" by Ryan Holiday, the author mentions the story of Rubin ""Hurricane"" Carter, a man wrongly ..."
https://www.youtube.com/watch?v=qKHF0r1Zla8,qKHF0r1Zla8,2020-01-01T13:00:07Z,when your man-crush acknowledges you,Thanks for the shoutout Matt! Sorry this sketch got a little creepy. https://www.instagram.com/nrajapandey.
https://www.youtube.com/watch?v=ijcJhCqlnLQ,ijcJhCqlnLQ,2019-10-16T12:00:07Z,*Watches One Stoicism Video*,"Memento Mori, Brotha. We must serve Marcus Aurelius. ----------- INSTAGRAM: @nrajapandey ..."
https://www.youtube.com/watch?v=uQ9Lm4ryXnU,uQ9Lm4ryXnU,2019-12-04T14:46:30Z,*Watches Jordan Peterson Twice*,No one can help you face the chaos and open the gates like this man can. INSTAGRAM: @nrajapandey ...
https://www.youtube.com/watch?v=2fcWGB-RABM,2fcWGB-RABM,2019-09-18T12:00:01Z,*Watches Jordan Peterson Once*,"Keep Your Back Straight. Face the chaos. Carl Jung. Lobsters. This isn't becoming a comedy channel, I swear."
https://www.youtube.com/watch?v=mT-pVikSt7U,mT-pVikSt7U,2019-12-23T23:01:28Z,*Watches David Goggins Twice*,Ho ho ho! To all the boys and girls with that true dog mentality. https://www.instagram.com/nrajapandey (We will return to the ...
https://www.youtube.com/watch?v=XkR5EdT5LKk,XkR5EdT5LKk,2019-10-02T12:00:08Z,*Watches Jocko Willink Once*,"Jocko Willink's book ""Extreme Ownership,"" is a masterpiece in my opinion. I'll do a serious video about it soon. In the meanwhile ..."
https://www.youtube.com/watch?v=XwcEDe2v2Tw,XwcEDe2v2Tw,2023-11-15T05:52:45Z,Pay Attention to the Women Who Want you,If you are a busy professional or entrepreneur who wants to quickly grow your YouTube channel to over 100000 subscribers in ...
https://www.youtube.com/watch?v=uzeqX0hJgc4,uzeqX0hJgc4,2021-01-23T13:00:17Z,*Watches Ali Abdaal Once*,Thanks to Surfshark VPN being a sponsor for this channel. Go to https://Surfshark.deals/captainsinbad and use code ...
https://www.youtube.com/watch?v=rHHCWO0uUYE,rHHCWO0uUYE,2021-03-25T13:00:11Z,*Watches Valuetainment Once*,A big thank you to Magic Spoon for sponsoring this video! Go to https://www.magicspoon.com/sinbad and use the code SINBAD at ...
https://www.youtube.com/watch?v=BFs-a-hqs2I,BFs-a-hqs2I,2020-02-19T13:00:05Z,*Watches Ben Shapiro Twice*,"For cryin' out loud, stop mainstreaming delusion. https://www.instagram.com/nrajapandey The outro is Ghanchakkar Babbu by ..."
https://www.youtube.com/watch?v=41j2gDBfgBg,41j2gDBfgBg,2018-07-01T05:27:04Z,NoFap and Ancient Wisdom,"The Gayatri Mantra - Om Bhoor Bhuvah Swaha, Tat Savitur Varenyam, Bhargodevasya Dheemahi, Dheeyo Yo Nah Prachodayat ..."
https://www.youtube.com/watch?v=-uf8CnkMIeU,-uf8CnkMIeU,2022-06-16T01:30:00Z,*Watches Hamza Once*,"To be frank, Jeffrey is my lover. Stop talking trash about him. CONNECT WITH ME: https://www.instagram.com/nrajapandey ..."
https://www.youtube.com/watch?v=Plc4OXQzQsU,Plc4OXQzQsU,2019-09-04T12:00:04Z,*Listens to Joe Rogan Podcast Once*,Stevie Emerson was certainly the inspiration - he did it first and better: https://www.youtube.com/user/EmersonStevie This was ...
https://www.youtube.com/watch?v=AOnYcufUXkc,AOnYcufUXkc,2023-09-06T15:19:19Z,Retention Makes Everything Easier,If you are a busy professional or entrepreneur who wants to quickly grow your YouTube channel to over 100000 subscribers in ...
https://www.youtube.com/watch?v=9cj8TkwA1m4,9cj8TkwA1m4,2021-08-26T12:42:51Z,I Tried Theodore Roosevelt&#39;s Insane Daily Routine for 7 Days,Save time on your work and emails with Grammarly! Sign up for a free account and get 20% off Grammarly Premium: ...
https://www.youtube.com/watch?v=None,,2020-07-20T12:20:24Z,The Genre Series,"A new series I'm extremely excited about. These videos bridge topics in self-development, with narratives from movie genres to ..."
https://www.youtube.com/watch?v=None,,2021-03-15T14:31:35Z,Lifestyle Challenges,
https://www.youtube.com/watch?v=None,,2019-02-09T03:46:35Z,Philosophy,
https://www.youtube.com/watch?v=None,,2018-11-19T14:19:04Z,Great Lives,
https://www.youtube.com/watch?v=None,,2019-02-06T19:10:23Z,Productivity,
https://www.youtube.com/watch?v=None,,2019-11-17T07:45:33Z,Sketches,All self-improvement and no laughter makes for a dull life.
https://www.youtube.com/watch?v=None,,2020-03-04T15:52:39Z,Favorites,
https://www.youtube.com/watch?v=9fM7CSJaJtE,9fM7CSJaJtE,2023-09-29T12:02:45Z,Your Face Works The Same As Your Abs,Don't miss out on the most relaxing sleep ever with Magnesium Breakthrough. For an exclusive offer for my listeners go to ...
https://www.youtube.com/watch?v=juzkwPa_1Xc,juzkwPa_1Xc,2022-12-06T14:00:31Z,How to Make the Next 100 Days the Best of Your Life,"If you're interested in growing your own YouTube channel faster, I would love to help you. Apply for Coaching Here: ..."
https://www.youtube.com/watch?v=VHJqoZ4EnDY,VHJqoZ4EnDY,2023-07-24T13:10:24Z,How to Make the Greatest Comeback of Your Life,If you are a busy professional or entrepreneur who wants to quickly grow your YouTube channel to over 100000 subscribers in ...
https://www.youtube.com/watch?v=F7Jx_OqdQxg,F7Jx_OqdQxg,2020-02-12T13:00:06Z,*Watches Ben Shapiro Once*,"I hate the left so much, I don't even like to walk left. https://www.instagram.com/nrajapandey."
https://www.youtube.com/watch?v=AERy25bwU4o,AERy25bwU4o,2021-09-25T13:00:05Z,The Rise of BULLSH*T Jobs,A big thank you to EveryPlate for sponsoring this video! Try EveryPlate for just $1.99 per meal with code SINBAD199 at ...
https://www.youtube.com/watch?v=Q6eca98MiUM,Q6eca98MiUM,2023-11-08T05:39:32Z,How I UnF*cked My Life,If you feel like you're not fully maximizing your potential — both personally and professionally — then you owe it to yourself to try ...
https://www.youtube.com/watch?v=TivGREUOmxI,TivGREUOmxI,2022-05-13T14:00:21Z,90% of Men are Unattractive,"If you're interested in growing your own YouTube channel faster, I would love to help you. Apply for Coaching Here: ..."
https://www.youtube.com/watch?v=L7wKG8hTL7E,L7wKG8hTL7E,2023-08-13T15:29:45Z,These habits make you MAGNETIC.,If you are a busy professional or entrepreneur who wants to quickly grow your YouTube channel to over 100000 subscribers in ...
https://www.youtube.com/watch?v=gj-O_cCyufo,gj-O_cCyufo,2023-02-21T20:14:11Z,Do The Basics. Get 95% of the Results.,If you are someone who already has some experience on YouTube and wants to get to 100000+ subscribers in a year and make ...
https://www.youtube.com/watch?v=RBRuw_es504,RBRuw_es504,2023-11-24T15:50:06Z,How to be Potent,"Your well-rested, calmer, and healthier self will thank you. Remember, it's https://bioptimizers.com/captainsinbad with code ..."
https://www.youtube.com/watch?v=95pje4HfhjI,95pje4HfhjI,2021-10-25T04:28:49Z,I Tried Marcus Aurelius&#39; Daily Routine for 30 Days (Stoicism),Save time on your work and emails with Grammarly! Sign up for a free account and get 20% off Grammarly Premium: ...
https://www.youtube.com/watch?v=R6mpA5_VzW8,R6mpA5_VzW8,2022-02-23T14:54:38Z,Quitting Alcohol for 30 Days: 7 Benefits I’ve Experienced,Invest in blue-chip art for the very first time by signing up for Masterworks: https://masterworks.art/sinbad Purchase shares in great ...
https://www.youtube.com/watch?v=Rdqyeo_d-2M,Rdqyeo_d-2M,2023-09-01T14:51:45Z,You Need a Commonplace Book to Progress Towards Your Dreams,"Sign up with Notion for free using my link, and duplicate my template on Notion Templates to easily get started. template links: ..."
https://www.youtube.com/watch?v=3tfnIrEBoXA,3tfnIrEBoXA,2022-06-04T12:41:38Z,What a Top 1% Man Looks Like,"If you're interested in growing your own YouTube channel faster, I would love to help you. Apply for Coaching Here: ..."
https://www.youtube.com/watch?v=1QKHMh1uMpo,1QKHMh1uMpo,2023-08-22T20:20:19Z,A Complete Guide to Instagram (for Dating and Business),If you are a busy professional or entrepreneur who wants to quickly grow your YouTube channel to over 100000 subscribers in ...
https://www.youtube.com/watch?v=ltSv1eG4Svs,ltSv1eG4Svs,2023-06-04T13:42:45Z,Make People Want You: How to Play the Game of Status and Social Proof,If you are someone who already has some experience on YouTube and wants to get to 100000+ subscribers and make a full-time ...
https://www.youtube.com/watch?v=5FfzbWWHIv8,5FfzbWWHIv8,2023-01-20T14:00:07Z,How to Be Socially Attractive AF,If you are someone who already has some experience on YouTube and wants to get to 100000+ subscribers and make a full-time ...
https://www.youtube.com/watch?v=EMcQf36K4Kk,EMcQf36K4Kk,2023-09-19T02:32:57Z,Life is a Video Game. Play it like a Millionaire.,If you are a busy professional or entrepreneur who wants to quickly grow your YouTube channel to over 100000 subscribers in ...
https://www.youtube.com/watch?v=4JPuGEANfgk,4JPuGEANfgk,2022-07-25T12:00:03Z,*Watches Andrew Tate Once*,"If you're interested in growing your own YouTube channel faster, I would love to help you. Apply for 1-1 Coaching Here: ..."
https://www.youtube.com/watch?v=O_kw4hCJF4s,O_kw4hCJF4s,2023-11-06T20:24:00Z,A Day in My Life with the OnePlus Open,The OnePlus Open is their first foldable phone. Get the OnePlus Open at https://bit.ly/402EVsr. ------- If you are a busy professional ...
